{
  "$schema": "https://json-schema.org/draft/2020-12/schema",
  "$id": "loom.agent.session.v1",
  "title": "LOOM Agent Session v1",
  "type": "object",
  "required": [
    "schema",
    "sessionId",
    "title",
    "status",
    "runtimeProfileId",
    "createdAt",
    "updatedAt"
  ],
  "properties": {
    "schema": {
      "const": "loom.agent.session.v1"
    },
    "sessionId": {
      "type": "string",
      "minLength": 1
    },
    "title": {
      "type": "string",
      "minLength": 1
    },
    "status": {
      "enum": [
        "active",
        "archived"
      ]
    },
    "runtimeProfileId": {
      "type": "string",
      "minLength": 1
    },
    "createdAt": {
      "type": "string",
      "format": "date-time"
    },
    "updatedAt": {
      "type": "string",
      "format": "date-time"
    },
    "lastMessagePreview": {
      "type": "string"
    },
    "activeRunId": {
      "type": "string",
      "minLength": 1
    }
  },
  "additionalProperties": false
}
